{
  "schema_version": "1.0.0",
  "org_id": "org_demo",
  "plant_id": "plant_bhatia",
  "work_id": "WO-55",
  "asset_id": "cell_vmc_12",
  "status": "open",
  "blocks_production": true,
  "summary": "spindle vibration check",
  "observed_at": "2026-09-25T06:15:00Z",
  "lineage": {
    "source_system": "fixture",
    "connector_id": "ctx-1",
    "pack_id": "generic-csv",
    "pack_version": "1.0.0",
    "source_record_id": "row-1"
  }
}
